Title,URL,Date
What Is Data Scraping And How Can You Use It? - Target ...,https://www.targetinternet.com/what-is-data-scraping-and-how-can-you-use-it/,"Sep 13, 2017"
What is data scraping? - YouTube,https://www.youtube.com/watch?v=COeMzrSYgvw,"Oct 30, 2020 · Uploaded by The Hindu"
What Is Web Scraping And How Does It Work? | Zyte.com,https://www.zyte.com/learn/what-is-web-scraping/,"Nov 17, 2020 · Uploaded by Zyte"
What is DATA SCRAPING? What does DATA ... - YouTube,https://www.youtube.com/watch?v=omTtMylcWOI,"Sep 21, 2017 · Uploaded by The Audiopedia"
Web Scraping with Python - Beautiful Soup Crash Course,https://www.youtube.com/watch?v=XVv6mJpFOb0,"Nov 18, 2020 · Uploaded by freeCodeCamp.org"
8 Best Web Scraping Tools - Learn - Hevo Data,https://hevodata.com/learn/8-best-web-scraping-tools/,"Feb 6, 2021 · Uploaded by Hevo Data"
What is Web Scraping and What is it Used For? | ParseHub,https://www.parsehub.com/blog/what-is-web-scraping/,"Aug 1, 2021 · Uploaded by ParseHub"
Watch | What is data scraping? - The Hindu,https://www.thehindu.com/sci-tech/technology/what-is-data-scraping/article32908610.ece,"Oct 21, 2020"
How to Scrape Modern Websites for Data - YouTube,https://www.youtube.com/watch?v=vsmxMLmroyQ,"Mar 10, 2017 · Uploaded by Fullstack Academy"
7 Best Web Scraping Tools To Extract Data - Better ...,https://betterprogramming.pub/data-scraping-tools-7cb76eeab89e,"Apr 26, 2021 · Uploaded by Rakia Ben Sassi"
What is web scraping? Here's what you need to know about,https://www.businessinsider.com/what-is-web-scraping,"Jan 14, 2021"
Web Scraping Software - UiPath,https://www.uipath.com/solutions/technology/web-scraping-software,"Jan 31, 2015 · Uploaded by UiPath"
Data Scraping and Analysis using Python | by Jasmeet Singh,https://towardsdatascience.com/competitive-price-data-scraping-and-analysis-using-python-a1f34758155,"May 24, 2020 · Uploaded by Miguel Albrecht"
5 Best Web Scraping Tools in 2020! - YouTube,https://www.youtube.com/watch?v=QbkXCkcmHJI,"Apr 8, 2019 · Uploaded by Octoparse"
Data Scraping Crawler | Phantombuster,https://phantombuster.com/automations/toolbox/22972/data-scraping-crawler,"Jun 19, 2020 · Uploaded by PhantomBuster"
Web Scraping vs Data Mining: What's the Difference?,https://www.parsehub.com/blog/web-scraping-vs-data-mining/,"Mar 2, 2020 · Uploaded by ParseHub"
Automate Web Data Extraction and Scraping - HelpSystems,https://www.helpsystems.com/product-lines/automate/use/data-scraping-extraction,"Mar 20, 2017"
Web Scraping vs API: What's the Difference? | ParseHub,https://www.parsehub.com/blog/web-scraping-vs-api/,"Mar 9, 2020 · Uploaded by ParseHub"
The AZ of Web Scraping in 2020 [A How-To Guide] - DZone,https://dzone.com/articles/the-a-z-of-web-scraping-in-2020-a-how-to-guide,"Sep 1, 2020 · Uploaded by Dmitry Narizhnykh"
Tidy web scraping in R — Tutorial and resources - Towards ...,https://towardsdatascience.com/tidy-web-scraping-in-r-tutorial-and-resources-ac9f72b4fe47,"Aug 16, 2019 · Uploaded by Yrrah0015"
UiPath Data Scraping (Web Page to Excel) - Tutorial - YouTube,https://www.youtube.com/watch?v=vIAJvk4quqA,"Jan 22, 2020 · Uploaded by Anders Jensen"
The Best Web Scraping Tools for 2021 - ScrapingBee,https://www.scrapingbee.com/blog/web-scraping-tools/,"Feb 13, 2021 · Uploaded by Web Scraper"
Data Scraping for SEO & Analytics - Tutorial - Optimize Smart,https://www.optimizesmart.com/data-scraping-guide-for-seo/,"Oct 7, 2011 · Uploaded by Garrett French CL"
Intro to Web Scraping with Python and Beautiful Soup - YouTube,https://www.youtube.com/watch?v=XQgXKtPSzUI,"Jan 7, 2017 · Uploaded by Data Science Dojo"
Web Data Extraction Automation - UiPath,https://www.uipath.com/learning/video-tutorials/web-data-extraction-automation,"Jan 19, 2021 · Uploaded by UiPath"
Web Scraping With Python | Python Tutorial |Simplilearn,https://www.youtube.com/watch?v=HXzhC-CzAJ4,"Sep 20, 2020 · Uploaded by Simplilearn"
What is Web Scraping and What is it Used For?,https://www.youtube.com/watch?v=Ct8Gxo8StBU,"Sep 27, 2019 · Uploaded by ParseHub"
Screen Scraping software for desktop and web - UiPath,https://www.uipath.com/solutions/technology/screen-scraping,"Dec 5, 2014 · Uploaded by UiPath"
Web scraping data with Azure Data Factory - SQLShack,https://www.sqlshack.com/web-scraping-data-with-azure-data-factory/,"Aug 3, 2021 · Uploaded by ApexSQL by Quest"
Web Scraping with Python Online Class | LinkedIn Learning ...,https://www.linkedin.com/learning/web-scraping-with-python,"Dec 15, 2020 · Uploaded by Ryan Mitchell"
Learn How To Scrape Data Using Python | Great Learning,https://www.youtube.com/watch?v=ktNAhLp0ymg,"Jul 8, 2020 · Uploaded by Great Learning"
Simple Web Scraping using R - YouTube,https://www.youtube.com/watch?v=tuNuxCjBU3U,"Dec 8, 2015 · Uploaded by Melvin L"
Web Scraping - Research-IT,https://research-it.wharton.upenn.edu/data/webscraping/,"Jul 8, 2010 · Uploaded by MozendaSupport"
The Ultimate Guide to Web Scraping for Recruiters in 2021,https://research.aimultiple.com/web-scraping-recruitment/,"Aug 18, 2021 · Uploaded by Bright Data - Formerly Luminati Networks"
Web Scraping Techniques: How to Scrape Data from the Internet,https://www.parsehub.com/blog/web-scraping-techniques/,"Mar 16, 2020 · Uploaded by ParseHub"
Web Scraping Techniques: How to Scrape Data from the Internet,https://www.youtube.com/watch?v=WgfUrqMbokE,"Mar 25, 2021 · Uploaded by ParseHub"
Easy Web Scraping in Power BI - YouTube,https://www.youtube.com/watch?v=RnMrGaiVWtQ,"May 29, 2018 · Uploaded by BI Elite"
Data Analytics with Python by Web scraping: Illustration with ...,https://towardsdatascience.com/data-analytics-with-python-by-web-scraping-illustration-with-cia-world-factbook-abbdaa687a84,"Mar 3, 2018 · Uploaded by sentdex"
Web Scraping with Power BI Python - YouTube,https://www.youtube.com/watch?v=ELIbUZNCMWw,"Apr 15, 2020 · Uploaded by Pragmatic Works"
Top Web Scraping Services For Your Ecommerce Store,https://firebearstudio.com/blog/ecommerce-magento-web-scraping.html,"Feb 13, 2017 · Uploaded by Diogo Munaro"
Web Scraping Examples: How are Businesses Using Web ...,https://www.parsehub.com/blog/web-scraping-examples/,"Oct 28, 2019 · Uploaded by ParseHub"
Is Web Scraping Easy? How to Scrape Data without Coding ...,https://www.parsehub.com/blog/web-scraping-easy/,"Feb 10, 2020 · Uploaded by ParseHub"
Practical Introduction to Web Scraping in R | R-bloggers,https://www.r-bloggers.com/2019/04/practical-introduction-to-web-scraping-in-r/,"Apr 10, 2019 · Uploaded by Rsquared Academy"
Web Scraping Tool | Free Browser Extensions | Grepsr,https://www.grepsr.com/browser-extensions/,"Jun 9, 2016"
Node-red and Data Scraping - YouTube,https://www.youtube.com/watch?v=Pbh04Xq6Iuk,"May 28, 2019 · Uploaded by 40th coder o"
Web scraping for Beginners | Introduction guide - ParseHub,https://www.parsehub.com/blog/beginners-guide-to-web-scraping/,"Nov 17, 2020 · Uploaded by ParseHub"
A Quicker Way to Build Datasets through Web Scraping,https://towardsdatascience.com/a-quicker-way-to-build-datasets-through-web-scraping-4ce9e51e16d8,"Sep 10, 2020 · Uploaded by Grant McAuley"
Scraping Amazon Stores to Generate Price Alerts - Towards ...,https://towardsdatascience.com/scraping-multiple-amazon-stores-with-python-5eab811453a8,"May 28, 2020 · Uploaded by F Neves"
Intro To Web Scraping With Python - YouTube,https://www.youtube.com/watch?v=4UcqECQe5Kc,"Jul 29, 2018 · Uploaded by Traversy Media"
UiPath Basics #10 - Data Scraping to Excel - YouTube,https://www.youtube.com/watch?v=kOPfG44-CBw,"Jul 13, 2020 · Uploaded by Anders Jensen"
Web Scraping and APIs in 45 Minutes - YouTube,https://www.youtube.com/watch?v=NK-v_ar6hl0,"Nov 8, 2019 · Uploaded by The Information Lab"
Web Scraping Python Tutorial ITA - YouTube,https://www.youtube.com/watch?v=uCetHN6bqmQ,"Nov 24, 2020 · Uploaded by Tuttofaredigitale"
Web Scraping Tutorial | Python Beautifulsoup | Edureka,https://www.youtube.com/watch?v=mKxFfjNyj3c,"Dec 12, 2017 · Uploaded by edureka!"
Web Scraping with FileMaker Pro - YouTube,https://www.youtube.com/watch?v=C4mEpBUkA4E,"Apr 1, 2016 · Uploaded by ISO FileMaker Magazine"
In-Depth Guide to Web Scraping for Finance in 2021 - Research,https://research.aimultiple.com/web-scraping-for-finance/,"Aug 19, 2021 · Uploaded by Bright Data - Formerly Luminati Networks"
RPA for Web Scraping: In-Depth Guide in 2021 - Research,https://research.aimultiple.com/rpa-web-scraping/,"Jul 18, 2021 · Uploaded by ARGOS LABS"
Introduzione al Web scraping: cos'è e come si fa [Webinar],https://www.youtube.com/watch?v=S5XXCohoHtE,"Nov 27, 2017 · Uploaded by Lacerba.io"
Python Tutorial: Web Scraping with BeautifulSoup and Requests,https://www.youtube.com/watch?v=ng2o98k983k,"Nov 8, 2017 · Uploaded by Corey Schafer"
What can Web Scraping be Used For? | ParseHub,https://www.parsehub.com/blog/web-scraping-uses/,"Feb 17, 2020 · Uploaded by ParseHub"
9 Popular Cloud-based Web Scraping Solutions - Geekflare,https://geekflare.com/web-scraping-tools/,4 days ago · Uploaded by Web Scraper
I 10 migliori strumenti di web scraping per l'estrazione di dati ...,https://it.myservername.com/top-10-web-scraping-tools,"Feb 16, 2021"
"Web Scraping with Beautiful Soup, Selenium, or Scrapy?",https://towardsdatascience.com/web-scraping-with-beautiful-soup-selenium-or-scrapy-62c6f3545de7,"Dec 16, 2020 · Uploaded by Frank Andrade"
Screen Scraping Any Desktop Application - UiPath,https://www.uipath.com/learning/video-tutorials/screen-scraping-desktop-application,"Dec 19, 2014 · Uploaded by UiPath"
Web Scraping for SQL Machine learning using R scripts,https://www.sqlshack.com/web-scraping-for-sql-machine-learning-using-r-scripts/,"Dec 14, 2020 · Uploaded by ApexSQL by Quest"
Data Access: Web Scraping with R - Data Science Summer ...,https://socialdatascience.network/courses/webscraping.html,"Jul 20, 2021 · Uploaded by Hertie School Data Science Lab"
"Scraping Live Traffic Data in 3 Lines of Code, Step-by-Step",https://towardsdatascience.com/scraping-live-traffic-data-in-3-lines-of-code-step-by-step-9b2cc7ddf31f,"Apr 18, 2020 · Uploaded by GitHub"
Instant Data Scraper - Microsoft Edge Addons,https://microsoftedge.microsoft.com/addons/detail/instant-data-scraper/onnjkaofddpgfmbcnbnfacjacjamelfa,"Dec 11, 2019 · Uploaded by Web Robots"
In-Depth Guide to Web Scraping for Machine Learning in 2021,https://research.aimultiple.com/machine-learning-web-scraping/,"Aug 13, 2021 · Uploaded by CNET Highlights"
Online workshop: Web scraping with Google Chrome - YouTube,https://www.youtube.com/watch?v=umzqJuP1bwc,"Jul 1, 2021 · Uploaded by UK DATA SERVICE"
Implementing Web Scraping in Python with BeautifulSoup,https://www.geeksforgeeks.org/implementing-web-scraping-python-beautiful-soup/,"May 15, 2021 · Uploaded by GeeksforGeeks"
What is Web Scraping? - Grepsr,https://www.grepsr.com/blog/what-is-web-scraping/,"Oct 6, 2020 · Uploaded by Adam Walker"
How does web scraping work? | ParseHub,https://www.parsehub.com/blog/how-web-scraping-works/,"Feb 24, 2020 · Uploaded by ParseHub"
Web Scraping Tool to Extract Data from Websites - Agenty,https://www.agenty.com/products/scraping-agent/,"Oct 30, 2019 · Uploaded by Agenty"
NoCoding Data Scraper - Easy Web Scraping - Edge Add-ons,https://microsoftedge.microsoft.com/addons/detail/nocoding-data-scraper-i/daiklcgdelcbcmjepemiklfglodmofbm,"Aug 30, 2020 · Uploaded by NoCoding Web Data Scraper -visualized web scraping"
How To Scrape Data From A Website Into Excel - YouTube,https://www.youtube.com/watch?v=YQbe20G0ZSM,"Jan 6, 2018 · Uploaded by Freelancer Amin"
What is Web Scraping? - Blog | Oxylabs,https://oxylabs.io/blog/what-is-web-scraping,"Mar 16, 2021 · Uploaded by Oxylabs"
ImportFromWeb | Easy Web Scraping - Google Workspace,https://workspace.google.com/marketplace/app/importfromweb_easy_web_scraping/278587576794,"Jan 10, 2020 · Uploaded by NoDataNoBusiness"
How to Find Products to Sell Online Using Web Scraping,https://www.octoparse.com/blog/how-to-find-prodcts-to-sell-online-using-web-scraping,"Mar 11, 2021 · Uploaded by Octoparse"
web scraping using python for beginners - YouTube,https://www.youtube.com/watch?v=0_VZ7NpVw1Y,"Feb 14, 2018 · Uploaded by Hitesh Choudhary"
"How to Scrape Amazon Product Data: Names, Pricing, ASIN, etc.",https://www.parsehub.com/blog/scrape-amazon-product-data/,"Nov 9, 2020 · Uploaded by ParseHub"
QVC Can't Stop Web Scraping - Forbes,https://www.forbes.com/sites/ericgoldman/2015/03/24/qvc-cant-stop-web-scraping/,"Mar 24, 2015"
Can you Make Money from Web Scraping? - ParseHub,https://www.parsehub.com/blog/web-scraping-money/,"Mar 30, 2020 · Uploaded by ParseHub"
How to Maintain Data Quality While Web Scraping | Octoparse,https://www.octoparse.com/blog/how-to-maintain-data-quality-while-web-scraping,"Jan 20, 2021 · Uploaded by Octoparse"
Data Scraping: The Powerful Force of the Business World,https://www.linkedin.com/pulse/data-scraping-powerful-force-business-world-gabija-fatenaite,"Mar 31, 2020 · Uploaded by Taylor Mali"
Top 5 Web Scraping Tools to Use in Sourcing - WizardSourcer,https://wizardsourcer.com/top-5-web-scraping-tools-to-use-in-sourcing/,"Nov 6, 2018 · Uploaded by Dean Da Costa"
Web Scraper for Mac: How to Scrape Data from Any Website ...,https://www.parsehub.com/blog/web-scraper-mac/,"May 4, 2020 · Uploaded by ParseHub"
Data scraping semplice: estrarre 100 Url con una singola ...,https://www.youtube.com/watch?v=N_8Fr4Ml4PY,"Dec 7, 2016 · Uploaded by SEO Senza Chiacchiere"
Data Crawler - Web Scraping Tool & kostenloser Web Crawler,https://www.octoparse.de/DataCrawler,"Nov 14, 2017 · Uploaded by Octoparse"
How to Scrape Data from Online Stores With a Crawler,https://netpeaksoftware.com/blog/how-to-scrape-data-from-online-stores-with-a-crawler,"Aug 29, 2019 · Uploaded by Netpeak Software"
Pengenalan Web Scraping - Kemenkeu Learning Center,https://klc.kemenkeu.go.id/pengenalan-web-scraping/,"Aug 15, 2019"
Web Scraping vs Web Crawling: The Differences - Oxylabs,https://oxylabs.io/blog/crawling-vs-scraping,"May 4, 2021 · Uploaded by Oxylabs"
How much does Web Scraping cost? | ParseHub,https://www.parsehub.com/blog/web-scraping-cost/,"Apr 6, 2020 · Uploaded by ParseHub"
2 Steps to No-Code Web Scraping Into Webflow CMS - 2020,https://www.linkedin.com/pulse/2-steps-no-code-web-scraping-webflow-cms-2020-sudip-sengupta,"Sep 24, 2020 · Uploaded by Kenny Santos"
"Web Scraping Data from The Internet | SpringML, Inc.",https://www.springml.com/blog/web-scraping-data-from-the-internet/,"Jul 19, 2019 · Uploaded by Baolin Liu"
Robust & Resilient Web Scraping with AutoScrape - Medium,https://medium.com/analytics-vidhya/robust-resilient-web-scraping-with-autoscrape-3988169f1e22,"Sep 27, 2020 · Uploaded by Brandon Roberts"
3 Most Practical Uses of eCommerce Data Scraping Tools,https://www.octoparse.com/blog/most-practical-uses-of-ecommerce-data-scraping-tools,"Jun 2, 2020 · Uploaded by Octoparse"
Web Scraping Tool: come Estrarre Dati Dal web (free!),https://www.themarketingfreaks.com/2016/11/web-scraping-tool-come-estrarre-dati-dal-web-free/,"Nov 15, 2016 · Uploaded by Martin Hawksey"
Managed Web Scraping Service Platform for Enterprises,https://www.grepsr.com/web-scraping-service/,"Aug 10, 2021"
Web Data Scraping Using Python - LinkedIn,https://www.linkedin.com/pulse/web-data-scraping-using-python-vamsi-cherukuri,"Apr 23, 2020 · Uploaded by Central Innovation"
Web Scraping: Gathering Data Without Disruption - ShipStation,https://www.shipstation.com/webinars/web-scraping-gathering-data-without-disruption/,"Sep 19, 2018"
